{
  "$schema": "http://json-schema.org/draft-07/schema#",
  "$id": "handoff_row.schema.json",
  "title": "HandoffRow",
  "description": "V3.6 shared queue row -- the flattened, ChatGPT/Gmail-side-consumable view of one READY_TO_SEND lead. Keyed by lead_id (idempotent upsert, never appended). Split into two logical queues by preferred_channel (CONTACT_FORM -> CONTACT_FORM_READY queue, else -> EMAIL_READY queue) -- never mixed. Fields fall into two ownership groups: Lead-Engine-owned (recomputed fresh every sync, safe to overwrite) and external-owned (gmail_state, delivery_state, reply_state, follow_up_state, gmail_message_id, gmail_thread_id, suppression_reason once set externally -- Lead Engine's own sync never touches these after creation; only scripts/import_outreach_results.py does).",
  "type": "object",
  "required": [
    "lead_id", "business_id", "business_name", "domain", "website", "city", "state", "country",
    "niche", "sub_niche", "fit_confirmed", "fit_potential", "gap_confirmed", "gap_potential",
    "qualification_status", "why_this_company", "why_this_problem", "why_now", "why_likely_buyer",
    "primary_wedge", "wedge_confidence", "asset_type", "asset_summary",
    "contact_name", "contact_role", "contact_email", "identity_status", "identity_confidence",
    "preferred_channel", "subject", "body", "qa_status", "evidence_freshness",
    "prospect_timezone", "planned_local_date", "planned_local_window", "planned_pkt_time",
    "lead_engine_state", "gmail_state", "delivery_state", "reply_state", "follow_up_state",
    "gmail_message_id", "gmail_thread_id", "last_action", "last_action_at", "human_review",
    "suppression_reason", "created_at", "updated_at"
  ],
  "properties": {
    "lead_id": {"type": "string", "description": "== prospect_id, the stable idempotency key for this row"},
    "business_id": {"type": "string", "description": "Normalized website domain when known, else same as lead_id -- lets the same real business be recognized across a future recycled lead_id"},
    "business_name": {"type": "string"},
    "domain": {"type": ["string", "null"]},
    "website": {"type": ["string", "null"]},
    "city": {"type": ["string", "null"]},
    "state": {"type": ["string", "null"]},
    "country": {"type": ["string", "null"]},
    "niche": {"type": ["string", "null"]},
    "sub_niche": {"type": ["string", "null"], "description": "No sub-niche taxonomy exists in config/niches.yaml yet -- always null, never guessed"},
    "fit_confirmed": {"type": ["integer", "null"]},
    "fit_potential": {"type": ["integer", "null"]},
    "gap_confirmed": {"type": ["integer", "null"]},
    "gap_potential": {"type": ["integer", "null"]},
    "qualification_status": {"type": "string", "enum": ["QUALIFIED", "HIGH_PRIORITY"]},
    "why_this_company": {"type": ["string", "null"]},
    "why_this_problem": {"type": ["string", "null"]},
    "why_now": {"type": ["string", "null"]},
    "why_likely_buyer": {"type": ["string", "null"]},
    "primary_wedge": {"type": ["string", "null"], "description": "opportunity_type from primary_wedge.json"},
    "wedge_confidence": {"type": ["number", "null"], "minimum": 0, "maximum": 1},
    "asset_type": {"type": ["string", "null"]},
    "asset_summary": {"type": ["string", "null"]},
    "contact_name": {"type": ["string", "null"]},
    "contact_role": {"type": ["string", "null"]},
    "contact_email": {"type": ["string", "null"]},
    "identity_status": {"type": "string"},
    "identity_confidence": {"type": ["number", "null"], "minimum": 0, "maximum": 1},
    "preferred_channel": {"type": "string", "enum": ["NAMED_EMAIL", "COMPANY_EMAIL", "CONTACT_FORM"], "description": "NAMED_EMAIL/COMPANY_EMAIL -> EMAIL_READY queue; CONTACT_FORM -> CONTACT_FORM_READY queue, never mixed"},
    "subject": {"type": ["string", "null"]},
    "body": {"type": ["string", "null"]},
    "qa_status": {"type": "string"},
    "evidence_freshness": {"type": "string", "enum": ["FRESH", "STALE"]},
    "prospect_timezone": {"type": ["string", "null"]},
    "planned_local_date": {"type": ["string", "null"]},
    "planned_local_window": {"type": ["string", "null"]},
    "planned_pkt_time": {"type": ["string", "null"]},
    "lead_engine_state": {"type": "string", "description": "Lead Engine's own pipeline status at last sync (e.g. SEND_WINDOW_PLANNED) -- NEVER equated with gmail_state/delivery_state"},
    "gmail_state": {"type": ["string", "null"], "description": "External-owned. Null until scripts/import_outreach_results.py records a real event. READY_TO_SEND/SEND_WINDOW_PLANNED lead_engine_state != GMAIL_SENT gmail_state."},
    "delivery_state": {"type": ["string", "null"], "description": "External-owned. NO_BOUNCE_DETECTED != DELIVERED -- see OPERATING-RULES.md Sec.2."},
    "reply_state": {"type": ["string", "null"], "description": "External-owned."},
    "follow_up_state": {"type": ["string", "null"], "description": "External-owned."},
    "gmail_message_id": {"type": ["string", "null"], "description": "External-owned, set only by an imported GMAIL_SENT event"},
    "gmail_thread_id": {"type": ["string", "null"], "description": "External-owned, set only by an imported GMAIL_SENT event"},
    "last_action": {"type": ["string", "null"], "description": "The most recent state-changing action from either side (a sync republish or an imported event type)"},
    "last_action_at": {"type": ["string", "null"], "format": "date-time"},
    "human_review": {"type": "boolean", "description": "true once a HUMAN_HANDOFF event is imported, or the prospect itself carries a HUMAN_REVIEW status"},
    "suppression_reason": {"type": ["string", "null"], "description": "External-owned once set by an imported SUPPRESSED event or Lead Engine's own suppression registry at first export -- never silently cleared"},
    "created_at": {"type": "string", "format": "date-time", "description": "First time this lead_id was exported -- preserved across every re-sync"},
    "updated_at": {"type": "string", "format": "date-time", "description": "Last time Lead Engine's own fields were refreshed (every sync touches this even if nothing external changed)"}
  }
}
