{
  "lead_id": "roofing-exampleville-ex-example-roofing-co",
  "business_id": "example-roofing.test",
  "business_name": "Example Roofing Co.",
  "domain": "example-roofing.test",
  "website": "https://example-roofing.test/",
  "city": "Exampleville", "state": "EX", "country": "US",
  "niche": "roofing", "sub_niche": null,
  "fit_confirmed": 62, "fit_potential": 90, "gap_confirmed": 48, "gap_potential": 70,
  "qualification_status": "QUALIFIED",
  "why_this_company": "Independently owned, single-location roofer with a live GBP and website in a niche/city where Maps/organic search plausibly drives most new-customer inquiries.",
  "why_this_problem": "Rival Roofing Exampleville ranks #1 for the core money keyword and Example Roofing Co. does not appear in the top 10 for the same term.",
  "why_now": null,
  "why_likely_buyer": "Active website investment and a staffed contact form suggest ongoing marketing spend/attention, not an abandoned or dormant listing.",
  "primary_wedge": "COMPETITOR_GAP",
  "wedge_confidence": 0.8,
  "asset_type": "THREE_POINT_COMPARISON",
  "asset_summary": "3-point competitor comparison: Rival Roofing Exampleville vs. Example Roofing Co. on the core money keyword, service-page coverage, and review count.",
  "contact_name": null,
  "contact_role": null,
  "contact_email": "office@example-roofing.test",
  "identity_status": "COMPANY_INBOX_ONLY",
  "identity_confidence": 0.65,
  "preferred_channel": "COMPANY_EMAIL",
  "subject": "Quick note on Example Roofing Co. and the competitor gap I noticed",
  "body": "Hi,\n\nRival Roofing Exampleville ranks #1 for 'emergency roof repair exampleville' and Example Roofing Co. does not appear in the top 10 for that term.\n\nThat's real search volume going to a name your prospects already recognize as a competitor, not to you.\n\nI put together a quick 3-point comparison against them if useful -- no obligation either way, just flagging something specific to Example Roofing Co. rather than a generic pitch.\n\nAli",
  "qa_status": "QA_PASS",
  "evidence_freshness": "FRESH",
  "prospect_timezone": "America/Chicago",
  "planned_local_date": "2026-01-20",
  "planned_local_window": "07:00-08:30",
  "planned_pkt_time": "2026-01-20T18:00:00+05:00",
  "lead_engine_state": "SEND_WINDOW_PLANNED",
  "gmail_state": null,
  "delivery_state": null,
  "reply_state": null,
  "follow_up_state": null,
  "gmail_message_id": null,
  "gmail_thread_id": null,
  "last_action": "EXPORTED",
  "last_action_at": "2026-01-15T09:15:00+00:00",
  "human_review": false,
  "suppression_reason": null,
  "created_at": "2026-01-15T09:15:00+00:00",
  "updated_at": "2026-01-15T09:15:00+00:00"
}
